父はバーベキユーをするのがじょうずですけど、母はりょうりをするのがじょうずじゃないです。,父はバーベキユーを作るのがじょうずですけど、母はりょうりをするのがじょうずじゃないです。
きょねんディンゼルさんは中国に行きました。,去年、ディンゼルさんは中国に行きました。
中国の大学で八月から一月までにべんきょうしました。,中国の大学で八月から一月までべんきょうしました。
りょうりをするのが大きらいでしたから、すごくやせていました。,りょうりをするのが大きらいでしたから、すごくやせていました。
私の家族は四人いて、姉が一人います。,私の家族は四人いて、姉が一人います。
母は仕事がありません。,母は仕事がありません。
主婦ですが、ひまじゃない。,主婦ですが、ひまじゃない。
毎日いつも食べものを料理して、うちを掃除して、洗濯しますから。,毎日いつも食べものを料理して、うちを掃除したり、洗濯したりしますから。
でも、今ちょっと休んでいます。,でも、今ちょっと休んでいます。
私は大学にんでいますから。,私は大学にんでいますから。
姉もうちに住んでいません。,姉もうちに住んでいません。
去年の夏に彼と家お買いました。,去年の夏に彼と家を買いました。
それから犬おアダプトして、犬の名前はデクスターです。,それから犬をアダプトして、犬の名前はデクスターです。
デクスターは姉の子とおもいますよ。,デクスターは姉の子どもだとおもいますよ。
だから父はデクスターのおじいさんで、そのいぬが大好きです。,だから父はデクスターのおじいさんで、その犬が大好きです。
父の仕事は土木作業です。,父の仕事は土木作業です。
毎朝早い起きて、それか仕事は大変です。,毎朝早く起きて、それから仕事は大変です。
再来週私はうちに帰って、家族といっしょにゆっくりあそびます。,再来週私はうちに帰って、家族といっしょにゆっくりあそびます。
子どものころから、おんがくが大すきでした。,子どものころから、おんがくが大すきでした。
私はおんがくを聞いて、おんがくを作るのがすきです。,私はおんがくを聞いたり、おんがくを作ったりするのがすきです。
八さいの時、ピアノをひきにはじめました。,八才の時、ピアノをひきはじめました。
今 電じピアノが私のへやでありますから、毎日ピアノをひきます。,今、電子ピアノが私のへやにありますから、毎日ピアノをひきます。
時どき、ともだちとおんがくを作ります。,時どき、ともだちとおんがくを作ります。
MITでおんがくりろんをべんきょうしでいます。,MITでおんがくりろんをべんきょうしています。
よくクラシックおんがくをピアノをひきます。,よくクラシックおんがくをピアノでひきます。
でも、たいていロークおんがくを聞きます。,でも、たいていロックおんがくを聞きます。
よくさんぽしながら、おんがくを聞きます。,よくさんぽしながら、おんがくを聞きます。
ボストンこうきょうがくだんのコンサートに行くのがすきです。,ボストン交響楽団のコンサートに行くのがすきです。
おんがくはきれいくて、たのしいと思います。,音楽はきれいで、たのしいと思います。
私のかぞくは五人です。,私のかぞくは五人です。
きょねんの十月に、あねはけっこんしました。,きょねんの十月に、あねはけっこんしました。
今、あねはLong Engineering につとめています。,今、あねはLong Engineering につとめています。
あねのごしゅじんはアメリカ人ですけど、メキシコの食べものを食べるのがだいすきです。,あねのご主人はアメリカ人ですけど、メキシコの食べものを食べるのがだいすきです。
父はちょとせがひうくくて、しごとはだいくです。,父はちょっとせがひくくて、仕事は大工です。
あまりおさけを飲んでけど、ときどいビールを飲みます。,あまりおさけを飲まないけど、時々ビールを飲みます。
母もちょとせがひくくて、とてもしんせって、しゅふです。,母もちょっとせがひくくて、とてもしんせつで、しゅふです。
いもおとは十六さいで、高校のがくせいです。,いもうとは十六さいで、高校のがくせいです。
あたまがよくて、げんきで、クロスカントリーをするのがだいすきです。,あたまがよくて、げんきで、クロスカントリーをするのがだいすきです。
あねといもおとはたくさんペットがいます。,あねといもおとはたくさんペットがいます。
いもおとはいぬが二ひきいて、あひるが一ひきいます。,いもうとはいぬが二匹いて、あひるが一匹います。
あねはとりが二がひきいて、いぬが一ひきいて、にわとりが四ひきいます。,あねはとりが二ひきいて、いぬが一ぴきいて、にわとりが四ひきいます。
私は麻雀するのが好きです。,私は麻雀するのが好きです。
大学の一年生の時に、友達は私をMITの麻雀のサークルに連れてきました。,大学の一年生の時に、友達は私をMITの麻雀のサークルに連れてきてくれました。
それから、私は麻雀を習って、麻雀のサークルに入っていました。,それから、私は麻雀を習って、麻雀のサークルに入っています。
今、私は毎週土曜日にシモンスに麻雀しに行きます。,今、私は毎週土曜日にシモンスに麻雀をしに行きます。
一年生の時、私は忙しくなかったですから、たいてい午前三時ぐらいまでしました。,一年生の時、私は忙しくなかったですから、たいてい午前三時ぐらいまでしました。
今、私は十二時ぐらいまでします。,今、私は十二時ぐらいまでします。
麻雀するのが下手だと思います。,麻雀するのが下手だと思います。
でも、友達とするのはとても楽しいと思います。,でも、友達とするのはとても楽しいと思います。
時々、サークルは料理します。,時々、サークルは料理します。
サークルはとんかつとカレーを作りました。,サークルはとんかつとカレーを作りました。
今日は，私の一ばん好きな人をしょうかいします。,今日は，私の一ばん好きな人をしょうかいします。
私は四入かぞくです。,私は四入かぞくです。
父と母とおとうとがいます。,父と母とおとうとがいます。
父と母はソフトウェルエンジニアですそれから、母はNY につとめていて父はNJにつとめています。,父と母はソフトウェアのエンジニアで、母はNY につとめていて、父はNJにつとめています。
おとうとのなまえはリシで高校の一年生です。,おとうとのなまえはリシで高校の一年生です。
私のおやはインドにうまれましたけど、私とリシはアメリカにうまれました。,私のおやはインドでうまれましたけど、私とリシはアメリカでうまれました。
インドにかぞくがたくさんいます。,インドにかぞくがたくさんいます。
でも、インドにあまり行きませんだから、インドにすんでいるかぞくにあまりあいません。,でも、インドにあまり行きませんから、インドにすんでいるかぞくにあまりあいません。
私のかぞくはとてもたのしくておもしろいです。,私のかぞくはとてもたのしくておもしろいです。
よくカルドゲムとボルドゲムをします。,よくカードゲームとボードゲームをします。
たとえば、リシはモノポリをするのが大好きでとてもじょうずです。,たとえば、リシはモノポリをするのが大好きで、とてもじょうずです。
みんなおんがくもすきです。,みんなおんがくもすきです。
父はうたうのがじょうすです。,父はうたうのがじょうずです。
私はうたうのが好きですけど、じょうずじゃないです。,私はうたうのが好きですけど、じょうずじゃないです。
母はあまりうたいませんけど、おどるのが好きです。,母はあまりうたいませんけど、おどるのが好きです。
高校の時よくいっしょにあそんでいました。,高校の時よくいっしょにあそんでいました。
私の家ぞくは、四人で、カリフォニアのサンフランシスコにすんでいます。,私の家ぞくは、四人で、カリフォニアのサンフランシスコにすんでいます。
父はたくさんコンピュータの会社につとめていましたけど、今家でコンピュータのゲームを作っています。,父は以前コンピュータの会社につとめていましたけど、今、家でコンピュータのゲームを作っています。
母は大学生の後、会社員でしたけど、今何も仕事をしていません。,母は大学の後、会社員でしたけど、今何も仕事をしていません。
りょうりするのがすきですが、そうじするのがすきじゃないです。,料理するのがすきですが、そうじするのがすきじゃないです。
母はいぬとねこがだいすきです。,母はいぬとねこがだいすきです。
でも、父はペットがきらいですから、いぬかねこがいません。,でも、父はペットがきらいですから、いぬもねこもいません。
ざんねんですね。,ざんねんですね。
おとうとが一人あります。,おとうとが一人います。
高校生で、あたまがよくて、せが高い人です。,高校生で、あたまがよくて、せが高い人です。
コンピュータのゲームはおもしろくて、たのしいと思っていますから、いつもゲームをしています。,コンピュータのゲームはおもしろくて、たのしいと思いますから、いつもゲームをしています。
私はMITの大学生で、今ボストンにすんでいます。,私はMITの大学生で、今ボストンにすんでいます。
りょうにすんでいますから、へやはしずかじゃなくて、とてもにぎやかです。,りょうにすんでいますから、へやはしずかじゃなくて、とてもうるさいです。
たくさん友だちがいます。,たくさん友だちがいます。
それから、毎日友だちといっしょにしょくどうにばんごはんをたべに行っています。,それから、毎日友だちといっしょにしょくどうへ晩ごはんを食べに行っています。
すごくたのしいと思います。,すごくたのしいと思います。
ビデオゲームはしゅみです。,ビデオゲームはしゅみです。
とてもたのしいですよ。,とてもたのしいですよ。
ニンテンドのゲームをするのが大すきです。,任天堂のゲームをするのが大すきです。
よくマリオカートとスーパーマリオをします。,よくマリオカートとスーパーマリオをします。
ともだちとゲームをするのがすきですけど、一人でゲームをするのもすきです。,ともだちとゲームをするのがすきですけど、一人でゲームをするのもすきです。
大学にゲームをたくさんもってきました。,大学にゲームをたくさんもってきました。
でも、あまりひまじゃないです。,でも、あまりひまじゃないです。
私のりょうで、私とゲームをする人がいます。,私のりょうで、私とゲームをする人がいます。
私のりょうの人とゲームをするのが大すきですよ。,私のりょうの人とゲームをするのが大すきですよ。
子どもの時は、ゲームをしていたから、ときどきしゅくだいをしませんでした。,子どもの時は、ゲームをしていたから、ときどきしゅくだいをしませんでした。
今日は、私のかんこく人の友達を紹介します。,今日は、私のかんこく人の友達を紹介します。
友達の名前は、キムさんです。,友達の名前は、キムさんです。
キムさんは、１０年前、MITから卒業したです。,キムさんは、１０年前、MITを卒業しました。
キムさんは、とてもあたまがいいだと思います。,キムさんは、とてもあたまがいいと思います。
キムさんは、今ボストンに住んでいます。,キムさんは、今ボストンに住んでいます。
けっこんしていませんが、ガールフレンドがあります。,けっこんしていませんが、ガールフレンドがいます。
とてもきれいの人です。,とてもきれいな人です。
キムさんの仕事は、せいじの先生です。,キムさんの仕事は、せいじの先生です。
今、ボストン大学におしえるています。,今、ボストン大学でおしえています。
毎日とてもいそがしいだと言っていました。,毎日とてもいそがしいと言っていました。
でも、仕事はとてもおもしろいだと言っていました。,でも、仕事はとてもおもしろいと言っていました。
私はたくさん趣味がすきです。,私はたくさんの趣味があります。
私はサークルのかいちょうです。,私はサークルのかいちょうです。
毎しゅう十二時間ぐらいおどります。,毎しゅう十二時間ぐらいおどります。
サークルに23人あります。,サークルに23人います。
とても楽しくて、おもしろくて、たいへんです。,とても楽しくて、おもしろいですが、たいへんです。
それから、旅行に出かけるのがすきです。,それから、旅行に出かけるのがすきです。
今、２１国に行っていました。,今、２１か国に行きました。
去年の夏、友だちといっしょにタイ国に行きました。,去年の夏、友だちといっしょにタイに行きました。
ヒキングをして、たくさん食べものを食べて、ちょっとおさけを飲みました。,ハイキングをして、たくさん食べものを食べて、ちょっとおさけを飲みました。
とてもあつかったですけど、にぎやかな国でした。,とてもあつかったですけど、にぎやかな国でした。
来月、韓国に行きます。,来月、韓国に行きます。
かぞくが五人います。,かぞくが五人います。
父はフランス語の先生です。,父はフランス語の先生です。
母も先生ですけど、えい語の先生です。,母も先生ですけど、えい語の先生です。
父はせが高くて、めがねをかけています。,父はせが高くて、めがねをかけています。
母はあたまがよくて、しんせつな人です。,母はあたまがよくて、しんせつな人です。
そふとそぼはペンシルベニアにすんでいます。,そふとそぼはペンシルベニアにすんでいます。
いもうとが二人います。,いもうとが二人います。
なまえはエリーゼさんとエミリーさんです。,なまえはエリーゼさんとエミリーさんです。
エミリーさんは大学生で、せんこうは経済です。,エミリーさんは大学生で、せんこうは経済です。
エリーゼさんは高校生で、おもしろいです。,エリーゼさんは高校生で、おもしろい人です。
かみがとてもながいです。,かみがとてもながいです。
せんしょうかぞくはMITに私を見に行きました。,先週、かぞくはMITに私に会いにきました。
私はMARVELがすきですから、かぞくとBLACK PANTHERを見ました。,私はMARVELがすきですから、かぞくとBLACK PANTHERを見ました。
それから、かぞくはピッツバーグにすんでいますから、日曜日にボストンからピッツバーグまでひこうきで帰りました。,それから、かぞくはピッツバーグにすんでいますから、日曜日にボストンからピッツバーグまでひこうきで帰りました。
かぞくがだいすきです。,かぞくがだいすきです。
私のマサチューセッツ工科大学生生活はとても簡単です。,私のマサチューセッツ工科大学での学生生活はとてもシンプルです。
毎日午前八時半ごろ起きて、シャワーを浴びています。,毎日午前八時半ごろ起きて、シャワーを浴びています。
それから、生化学のクラスに行っています。,それから、生化学のクラスに行っています。
たいてい時間がありませんから、朝ごはんを食べません。,たいてい時間がありませんから、朝ごはんを食べません。
しかし、午後十二時ごろ友だちと学生センターに昼ご飯を食べにいっています。,しかし、午後十二時ごろ友だちと学生センターに昼ご飯を食べにいっています。
三時ごろ部屋に帰って、日本語の宿題を始めます。,三時ごろ部屋に帰って、日本語の宿題を始めます。
今年私のクラスはちょっと難しいから、たいてい勉強しています。,今年私のクラスはちょっと難しいから、たいてい勉強しています。
もちろん、自由時間がありません。,もちろん、自由時間がありません。
ときどき、友だちとボストンのチャイナタウンでおいしいスナックを買います。,ときどき、友だちとボストンのチャイナタウンでおいしいスナックを買います。
これ生活はちょっと大変ですけど、嫌いじゃないと思います。,この生活はちょっと大変ですけど、嫌いじゃないと思います。
このは私の簡単日常生活です。,これは私のシンプルな日常生活です。
私はたくさん趣味があります。,私はたくさん趣味があります。
大学生ですから、よくべんきょうしています、あまりひまじゃないです。,大学生ですから、よくべんきょうしているし、あまりひまじゃないです。
でも、ひまな時にあそぶのが好きです。,でも、ひまな時にあそぶのが好きです。
まず、しゃしんをとるのが大好きです。,まず、しゃしんをとるのが大好きです。
十六さいのたんじょうびに、父に大きいカメラをもらって、とてもおもしろいと思いました。,十六さいのたんじょうびに、父に大きいカメラをもらって、とてもおもしろいと思いました。
りょこうの時にいつもカメラをも ってきます。,りょこうの時にいつもカメラをも ってきます。
今ボストンでときどき週末にしゃしんをとります。,今ボストンでときどき週末にしゃしんをとります。
次、ジョギングをするの好きです。,次に、ジョギングをするの好きです。
いちにちおきにチャールズ川のとなりでジョギングをします。,一日おきにチャールズ川のとなりでジョギングをします。
去年、ケンブリッジのハーフマラソン  をしました。,去年、ケンブリッジのハーフマラソン をしました。
さいごに、おでるのが好きです。,さいごに、おどるのが好きです。
MIT Asian Dance Team のさサークルに入っています。,MIT Asian Dance Team のサークルに入っています。
韓国のヒップホップ  をしています。,韓国のヒップホップ  をしています。
毎週水曜日と土曜日と日曜日におどります。,毎週水曜日と土曜日と日曜日におどります。
にぎやかで、たのしいですよ。,にぎやかで、たのしいですよ。
今日は、私の日本語のクラスの先生を紹介します。,今日は、私の日本語のクラスの先生を紹介します。
去年、私は２０２０年の東京のオリンピックを見に行くと思いましたから、MITで日本語の勉強を始まりました。,去年、私は２０２０年の東京のオリンピックを見に行くと思いましたから、MITで日本語の勉強を始めました。
相川先生は日本人で、MITで言語学の研究していますから、私の日本語のクラスの先生をなりました。,相川先生は日本人で、MITで言語学の研究していますから、私の日本語のクラスの先生になりました。
相川先生は背が低くて、眼鏡を掛けています。,相川先生は背が低くて、眼鏡を掛けています。
でも、全然怖くないです。,でも、全然怖くないです。
先生もとても優しくて、辛抱強いと思います。,先生もとても優しくて、辛抱強いと思います。
先生は教えるのが上手で、クラスもとても面白いでしたから、人気がたくさんあります。,先生は教えるのが上手で、クラスもとても面白いですから、とても人気があります。
所で、たくさん学生が日本語のクラスでいて、先生は早くみんなさんの名前を覚えて、凄いでした。,日本語のクラスには、たくさん学生がいましたが、先生は早くみんなの名前を覚えて、凄かったです。
相川先生はMITに勤めているが、Somervilleに住んでいると言っていました。,相川先生はMITに勤めているが、Somervilleに住んでいると言っていました。
それから、毎日電車に乗って、大学に日本語を教えに行きます。,それから、毎日電車に乗って、大学に日本語を教えに行きます。
先生はジョギングが大好きだと言っていました。,先生はジョギングが大好きだと言っていました。
だから、毎日先生はとても元気です。,だから、毎日先生はとても元気です。
私の家ぞくは四人家ぞくです。,私の家ぞくは四人家ぞくです。
母の名まえはキャシーで，今は四十七さいです。,母の名まえはキャシーで，今は四十七さいです。
とてもきれいで、しんせつで、あたまがいい人です。,とてもきれいで、しんせつで、あたまがいい人です。
りょうりするのがじょうずです。,りょうりするのがじょうずです。
母はアメリカの会社につとめています。,母はアメリカの会社につとめています。
父の名まえはトニーで、今は五十五さいです。,父の名まえはトニーで、今は五十五さいです。
せが高くて、ちょっとふとっています。,せが高くて、ちょっとふとっています。
ゴルフをするのが大すきです。,ゴルフをするのが大すきです。
父もアメリカの会社につとめています。,父もアメリカの会社につとめています。
めがねをかけています。,めがねをかけています。
りょうしんはカリフォルニアにすんでいますけど、中国によく行きます。,りょうしんはカリフォルニアにすんでいますけど、中国によく行きます。
あにが一人います。,あにが一人います。
名まえはダニエルで、二十二さいです。,名まえはダニエルで、二十二さいです。
今は大学の四年生ですから、とてもいそがしです。,今は大学の四年生ですから、とてもいそがしいです。
せんこうはコンピューターです。,せんこうはコンピューターです。
今日は、私の中国人の友達を紹介します。,今日は、私の中国人の友達を紹介します。
友達の名前はペンさんです。,友達の名前はペンさんです。
ペンさんもMITの一年生です。,ペンさんもMITの一年生です。
彼の専攻は数学です。,彼の専攻は数学です。
ペンさんは、すごく頭がよくて、静かな人です。,ペンさんは、すごく頭がよくて、静かな人です。
彼は国際数学オリンピックのメダリストです。,彼は国際数学オリンピックのメダリストです。
彼は代数と組合せ数学がとても好きで、上手です。,彼は代数と組合せ数学がとても好きで、上手です。
毎日たくさん数学の問題を解きます。,毎日たくさん数学の問題を解きます。
暇の時、ペンさんはたくさん本を読みます。,暇な時、ペンさんはたくさん本を読みます。
文学も好きですから。,文学も好きですから。
それに、彼をアイススケートとサッカーをします。,それに、彼はアイススケートとサッカーをします。
