囲碁はとても難しいゲームですけど、とてもおもしろくて、きれいです。,囲碁はとても難しいゲームですけど、とてもおもしろくて、きれいです。
私は、四人かぞくです。,私は、四人家族です。
おとうとが一人いて、二十三さいです。,おとうとが一人いて、二十三さいです。
おとうとは、メリーランドにすんでいて、コンピュータの会社員です。,おとうとは、メリーランドにすんでいて、コンピュータの会社員です。
とてもしずかでから、子どもの時、あまりはなしませんでした。,とてもしずかでから、子どもの時、あまり話しませんでした。
今、時々はなします。,今、時々話します。
私のりょうしん は 、カリフォルニア にすんでいます。,私の両親 は 、カリフォルニア に住んでいます。
母は、小学校の先生でしたが今、しゅふです。,母は、小学校の先生でしたが今、主婦です。
父は、かぞくの会社で社ちょうです。,父は、家族の会社の社長です。
いそがしい人ですが、しんせつです。,いそがしい人ですが、しんせつです。
らいねんの十月、私はけっこんします。,来年の十月、私は結婚します。
私のフィアンセは、ボストンにすんでいます。,私のフィアンセは、ボストンにすんでいます。
いそがしくて、とてもあたまがいい人です。,いそがしくて、とてもあたまがいい人です。
りょうりがじょうずで、アジアの食べものがすきです。,閭里が上手で、アジアの食べものが好きです。
ねこが二ひきいて、かわいくて元気ですよ。,ねこが二ひきいて、かわいくて元気ですよ。
このねこも、私のかずくだ、と思います。,このねこも、私のかずくだと思っています。
私の家族は四人の家族です。,私の家族は四人の家族です。
父は会社に勤めていますから、忙しいです。,父は会社に勤めていますから、忙しいです。
でも休みの時、父は時々私にゴルフを教えます。,でも休みの時、父は時々私にゴルフを教えてくれます。
父はゴルフをするのが上手で、すごくかっこいい人です。,父はゴルフをするのが上手で、すごくかっこいい人です。
私の母はとても優しい人です。,私の母はとても優しい人です。
母の中国の料理は一番だと思います。,母の中国の料理は一番だと思います。
母のチキンスープが大きです。,母のチキンスープはおいしいです。
それから、兄弟は一人います。,それから、兄弟は一人います。
弟です。,弟です。
弟はすごく面白い子供です。,弟はすごく面白い子供です。
今、高校の三年生ですから、大学のテストを勉強して、忙しいです。,今、高校の三年生ですから、大学のテストを勉強していて、忙しいです。
来年、有名な大学を絶対に入ると言っています。,来年、有名な大学に絶対に入ると言っています。
私もそう思います。,私もそう思います。
私は今年の春に六つの大学院のオープンハウスに参加するから、旅行をたくさんします。,私は今年の春に六つの大学院のオープンハウスに参加するから、旅行をたくさんします。
オープンハウスは、大学院の先生が将来の学生に学校を紹介するイヴェントです。,オープンハウスは、大学院の先生が将来の学生に学校を紹介するイベントです。
私はオープンハウスに大学院の先生達に会って、勉強と研究について話します。,私はオープンハウスで大学院の先生達に会って、勉強と研究について話します。
まずは三月十二日にボストンからサンフランシスコまで飛行機で行って、空港で電車に乗って、スタンフォード大学へ行きます。,まず、三月十二日にボストンからサンフランシスコまで飛行機で行って、空港から電車に乗って、スタンフォード大学へ行きます。
次は、三月十四日にバスで近くのバークレー大学へいって、二日間います。,次は、三月十四日にバスで近くのバークレー大学へ行って、二日間そちらに滞在します。
週末はボストンに飛行機で帰って、ちょっと休んで、日曜日にロスアンジェルスのカルテックへ行きます。,週末はボストンへ飛行機で帰って来て、ちょっと休んで、日曜日にロスアンジェルスのカルテックへ行きます。
春休みに私は友達とマイアミへ海で遊びに行きます。,春休みに私は友達とマイアミの海へ遊びに行きます。
その後の三月二十八日にプリンストン大学へ行きます。,その後の三月二十八日にプリンストン大学へ行きます。
オープンハウスに参加して、あそこの友達に会います。,オープンハウスに参加して、あそこの友達に会います。
最後の二つの学校はハーバード大学とMITです。,最後の二つの学校はハーバード大学とMITです。
クラスのあとでオープンハウスに行くつもりです。,クラスのあとでオープンハウスに行くつもりです。
今年の春は本当に大変で、忙しいと思います。,今年の春は本当に大変で、忙しいと思います。
踊るのがとても大好きですけど、上手じゃないです。,踊るのがとても大好きですけど、上手じゃないです。
高校の時、私の友達とJ-POPをしました。,高校の時、私の友達とJ-POPをしました。
私の友達も踊るのが好きです。,私の友達も踊るのが好きです。
友達は一緒に躍りましょかと言っていました。,友達は一緒に躍りましょかと言っていました。
高校三年の夏、私はダンスをは始めました。,高校三年の夏、私はダンスを始めました。
次の夏、J-POPとK-POPしました。,次の夏、J-POPとK-POPしました。
毎日、学校と家で二時間ぐらい踊りました。,毎日、学校と家で二時間ぐらい踊りました。
週末、ダンスワークショップに行きました。,週末、ダンスワークショップに行きました。
今、MITのADTをします。,今、MITのADTをしています。
ADTで、たくさん友達と会いました。,ADTで、たくさん友達に会いました。
毎週の金曜日、二時間練習あります。,毎週金曜日に、二時間練習があります。
でも、よくOffice Hourに行きます。,でも、よくOffice Hourに行きます。
火曜日と木曜日たくさんクラスがありませんから、McCormickのスタジオで一人で踊ります。,火曜日と木曜日たくさんクラスがありませんから、McCormickのスタジオで一人で踊ります。
だから、毎週七時間ぐらいダンスおします。,だから、毎週七時間ぐらいダンスをします。
私のかぞくはちょうと大きいと思います。,私のかぞくはちょうと大きいと思います。
かぞくは九人いて、ぎりの兄弟が四人いて、弟が一人います。,家族は九人いて、ぎりの兄弟が四人いて、弟が一人います。
子どもの時、毎週末私とぎりの弟は外にあそびました。,子どもの時、毎週、週末は、私とぎりの弟は外であそびました。
火を作るのがすきでした。,焚き火をするのがすきでした。
時どき、火の上で卵をりょうりしました。,時どき、火の上で卵をりょうりしました。
今ぎりの兄弟はオハイオ州に住んでいませんから、あまり見ません。,今義理の兄弟はオハイオ州に住んでいませんから、あまり会いません。
父の仕事は銀行員です。,父の仕事は銀行員です。
父はハンティントン・バンクにつとめていますけど、かぞくの銀行じゃないです。,父はハンティントン・バンクにつとめていますけど、かぞくの銀行じゃないです。
今ぎりの母とぎりの父は仕事がありません。,今、義理の母と義理の父は仕事がありません。
毎日曜日かぞくに電話します。,毎週、日曜日にかぞくに電話します。
父とぎりの母はいぬと毎日さんぽするのがすきです。,父と義理の母はいぬと毎日さんぽするのが好きです。
 先週さんぽしなかったと言っていました。, 先週さんぽしなかったと言っていました。
私 のかぞくが四人います。,私 のかぞくが四人います。
父と母と兄がいます。,父と母と兄がいます。
父と母はすごくやさしいですから、みんあはとても元気です。,父と母はすごくやさしいですから、みんあはとても元気です。
父と母はフォリダのミアミに住んでいます。,父と母はフォリダのマイアミに住んでいます。
ミアミはすごくあついです。,マイアミはすごくあついです。
父はUnited Airlines 会社につとめています。,父はUnited Airlines につとめています。
母は銀行につとめていましたが、今はしゅふです。,母は銀行につとめていましたが、今は主婦です。
母は54歳です。,母は54歳です。
それから父は49歳です。,それから父は49歳です。
兄は24歳です。,兄は24歳です。
大学の時せんこうはけいざいでしたから、今はヘジファンドにつとめています。,大学の時、専攻は経済でしたから、今はヘジファンドにつとめています。
ニューヨークにすんでいます。,ニューヨークに住んでいます。
兄はいそがしいですから、ちょっとふとっています。,兄はいそがしいですから、ちょっと太っています。
私のしゅみはアニメを見て、マンガを読んで、おんがくを聞いて、ゲームをします。,私のしゅみはアニメを見て、マンガを読んで、おんがくを聞いて、ゲームをすることです。
高校の時、たくさん友だちともだちがいました。,高校の時、たくさん、友だちがいました。
でも、わかい子どもの時友だちいませんでした。,でも、子どもの時、友だちがいませんでした。
私はさびしいでしたから、私は家にたくさんアニメを見にはじめました。,私はさびしかったから、家でたくさんアニメを見はじめました。
せんしゅうの金曜日七時ごろ私はアニメをともだちといっしょに見ました。,先週の金曜日七時ごろ私はアニメをともだちと一緒に見ました。
私は、そのアニメはたのしくて、おもしろいと思いました。,私は、そのアニメはたのしくて、おもしろいと思いました。
私はよくアニメをみてが、ときどきマンガを読みます。,私はよくアニメを見ますが、時々マンガも読みます。
火曜日と木曜日の午後、私はたいていアニメとしょかんにマンガを読みに行きます。,火曜日と木曜日の午後、私はたいていアニメ図書館へマンガを読みに行きます。
おととし私の友だちケーティさんはマンガがすきだと言っていました。,おととし私の友だちのケーティさんは、マンガがすきだと言っていました。
それから、ケーティさんと私はいっしょにマンガを読みにはじました。,それから、ケーティさんと私はいっしょにマンガを読みはじました。
しゅうまつ私はテレビを見て、ゲームをします。,週末、私はテレビを見て、ゲームをします。
あまりしゅくだいがありませんから。,あまり宿題がありませんから。
私はゲームをするのがへたですが、ゲームが大好きです。,私はゲームをするのがへたですが、ゲームが大好きです。
クラスをいきますの時、毎日私はおんがくを聞きます。,クラスを行く時、毎日私は音楽を聞きます。
私は日本語のおんがくを聞くのがすきですけど、たいてえい語を聞きます。,私は日本語の音楽を聞くのがすきですけど、たいてい英語の音楽を聞きます。
私はMITの二年生の学生で、しゅくだいとしけんがたくさんありますから、あまりひまでわありません。,私はMITの二年生の学生で、しゅくだいとしけんがたくさんありますから、あまりひまではありません。
でも、毎日家から学校まで歩く時おんがくをいつも聞きます。,でも、毎日家から学校まで歩いて来る時、音楽をいつも聞きます。
それから、ときどき時間がある時家でギターをひきます。,それから、ときどき時間があった時、家でギターをひきます。
私はおんがくを聞くのが大すきで、すきなジャンルはロックとヘビーメタルです。,私はおんがくを聞くのが大すきで、すきなジャンルはロックとヘビーメタルです。
私のすきなバンドは、アヴェンジド・セヴンフオールド、メタリカ、そうして、日本のBabymetal です。,私のすきなバンドは、アヴェンジド・セヴンフオールド、メタリカ、そうして、日本のBabymetal です。
ロックとヘビーメタルおんがくはとてもおもしろくて、すごくたのしいと思って、聞くのはとてもいいですけど、メタルのうたをうたうのはむずかしいですが、私はこのおんがくを大すきです。,ロックとヘビーメタルおんがくはとてもおもしろくて、すごくたのしいと思いますし、聞くのはいいですけど、メタルの歌を歌うのはむずかしいですが、私はこの音楽が大好きです。
それから、私は今学校で日本語を勉強していますから、Babymetal を聞くのはとても勉強をてつだいます。,それから、私は今学校で日本語を勉強していますから、Babymetal を聞くのはとても勉強をてつだいます。
日本のバンドですから、新しいたんごもぶんぽうを勉強するのはいいです。,日本の音楽ですから、新しい単語や文法を勉強するのには、いいです。
それから、ときどきギターをひきます。,それから、ときどきギターをひきます。
私はあまりギターをひくのが上手じゃないですが、ひくのが大好きです。,私はあまりギターをひくのが上手じゃないですが、ひくのが大好きです。
ときどきともだちとりょうでひきます。,時々ともだちと寮でひきます。
すごくたのしいです。,すごくたのしいです。
今日は、私のいもうとをしょうかいします。,今日は、私のいもうとをしょうかいします。
いもうとの名前は、美幸です。,いもうとの名前は、美幸です。
今美幸は九さいで、私の三ばんめのいもうとです。,今美幸は九さいで、私の三ばん目の妹です。
美幸はとてもやさしいです。,美幸はとてもやさしいです。
美幸は今りょおしんとケンブリッジにすんでいて、モールスがっこうの二ねん生です。,美幸は今両親とケンブリッジにすんでいて、モールス学校の二年生です。
美幸はわかいので、すごくかわいいです。,美幸はわかいので、すごくかわいいです。
めがねをかけて、かみがみじかくて、せがひくいです。,めがねをかけて、かみがみじかくて、せがひくいです。
美幸はおどりとソフトボールが大好ききです。,美幸はおどりとソフトボールが大好きです。
おどりのサークとソフトボールのサークルに入っています。,おどりのサークとソフトボールのサークルに入っています。
美幸はバービーが大好きです。,美幸はバービーが大好きです。
美幸とバービーとあそぶ。,美幸とバービーと遊ぶ。
今日私の家族を紹介します。,今日私の家族を紹介します。
四人家族です。,四人家族です。
父と母と妹と私です。,父と母と妹と私です。
中国人の家族で、カリフォルニア州のサンフランシスコ市に住んでいます。,中国人の家族で、カリフォルニア州のサンフランシスコ市に住んでいます。
母は48歳で、背が低くて、頭がいい女の人です。,母は48歳で、背が低くて、頭がいい女の人です。
母の仕事は年上の人のデイケアです。,母の仕事は年寄りのデイケアです。
毎朝午前7時に年寄りの人達の家へ行って、家をそうじしたり、食べ物を作ったりします。,毎朝午前7時に年上の人の家へ行って、家をそうじして、食べ物を作ります。
母は仕事がとても楽しくて、難しくないと言っていました。,母は仕事がとても楽しくて、難しくないと言っていました。
歌を歌うのが大好きですから、よく家で大きい声で歌っています。,歌を歌うのが大好きですから、よく家で大きい声で歌っています。
ちょっとうるさいと思います。,ちょっとうるさいと思います。
父は51歳で、背が高くて、頭が良くて、かっこいい人です。,父は51歳で、背が高くて、頭が良くて、かっこいい人です。
父の仕事は家の近くのレストランのチェフです。,父の仕事は家の近くのレストランのシェフです。
毎朝午前九時半ごろレストランへ行って、中国の食べ物を作ります。,毎朝午前九時半ごろレストランへ行って、中国の食べ物を作ります。
例えば、中国の餃子とか中国のパンを作ります。,例えば、中国の餃子とか中国のパンを作ります。
仕事はよく大変だと言っていました。,仕事はよく大変だと言っていました。
自然が大好きですから、よくハイキングをして、魚釣りをします。,自然が大好きですから、よくハイキングをして、魚釣りをします。
妹は19歳で、背が低くて、頭が良くて、きれいな女の人です。,妹は19歳で、背が低くて、頭が良くて、きれいな女の人です。
カリフォルニア州のデイビス大学 の二年生です。,カリフォルニア州のデイビス大学 の二年生です。
せんこうはグラフィックデザインです。,専攻はグラフィックデザインです。
妹はアートがとても上手ですから、よくいい成績をとります。,妹はアートがとても上手で、よくいい成績をとります。
ひまな時、妹は友達と話して、アニメとアメリアの映画を見て、ちょっとゲームをします。,ひまな時、妹は友達と話して、アニメとアメリカの映画を見て、ちょっとゲームをします。
とてもしんせつな人ですから、よく妹に電話をかけます。,とてもしんせつな人ですから、よく妹に電話をかけます。
私は21歳で、MITの大学三年生で、せんこうはコンピューターです。,私は21歳で、MITの三年生で、専攻はコンピューターです。
ひまな時、友達と話して、ボストンのレストランへ食べ物を食べに行って、ダンスをします。,ひまな時は、友達と話したり、ボストンのレストランへ食べに行ったり、ダンスをしたりします。
以上は私の家族です。,以上は私の家族です。
私はいもうととおにいちゃんがいます。,私は妹と兄がいます。
二人はカリフォルニアにすんでいます。,二人はカリフォルニアにすんでいます。
いもうとは十五さいで、高校に行っています。,いもうとは十五さいで、高校に行っています。
おにいちゃんは大学生で、コンピューターサイエンスをべんきょうしています。,兄は大学生で、コンピューターサイエンスを勉強しています。
父はウェアハウスにつとめています。,父はウェアハウスにつとめています。
毎日午前五時におきて、コーヒーを飲みます。,毎日午前五時におきて、コーヒーを飲みます。
毎日いそがしくて、たいへんだと思います。,毎日いそがしくて、たいへんだと思います。
母はしゅふです。,母はしゅふです。
りょうりをするのが好きです。,料理をするのが好きです。
ふゆ休みに母がつくれったりょうりをたくさん食べました。,冬休みに母がつくってくれた料理をたくさん食べました。
ふゆ休みはかぞくを見ましたから、たのしかったです。,冬休みはかぞくに会いましたから、たのしかったです。
今年のなつ、カリフォルニアにかぞくを見に行きます。,今年のなつ、カリフォルニアへかぞくに会いに行きます。
私のかぞくは小さくて、しんせつです。,私のかぞくは小さいですが、みんなしんせつです。
ニューヨークに住んでいます。,ニューヨークに住んでいます。
かぞくが四人います。,家族が四人います。
私と父と母とおとうとがいます。,私と父と母と弟がいます。
母はドナと言います。,母はドナと言います。
ドナは四十九さいです。,ドナは四十九さいです。
かがくの会社につとめちます。,かがくの会社につとめています。
母はせがひくくて、きびしいです。,母はせがひくくて、きびしいです。
父の名前はクワンです。,父の名前はクワンです。
父は五十六さいで、たんじょうびは四月四日です。,父は五十六さいで、たんじょうびは四月四日です。
父と母は中国人ですから、中国の食べ物をよく作ります。,父と母は中国人ですから、中国の食べ物をよく作ります。
父と母のりょうりはとてもおいしいですよ。,父と母のりょうりはとてもおいしいですよ。
おとうとの名前はイバンです。,弟の名前はイバンです。
イバンは高校生で、十五さいです。,イバンは高校生で、十五さいです。
おとうとはスポーツが大すきです。,弟はスポーツが大好きです。
毎ばん、イバンはうんどうして、ランニングのサークルをしに行きます。,毎ばん、イバンはうんどうしたり、ランニングのサークルをしたりします。
そして、しゅくだいをするのあとで、コンピュータゲームをよくします。,そして、しゅくだいをした後で、コンピュータゲームをよくします。
おとうとはとてもあたまがよくて、いそがしいと思います。,弟はとてもあたまがよくて、いそがしいと思います。
私の家族は４人です。,私の家族は４人です。
父と母と兄と私です。,父と母と兄と私です。
私の家族はみんなバージニアに住んでいます。,私の家族はみんなバージニアに住んでいます。
父は優しいけど、ちょっと静かな人です。,父は優しいけど、ちょっと静かな人です。
父は韓国の‘トロット’という音楽を聴くのが好きです。,父は韓国の‘トロット’という音楽を聴くのが好きです。
テレビでスポーツと韓国のドラマを見るのが大好きです。,テレビでスポーツと韓国のドラマを見るのが大好きです。
特に、野球とサッカーを見る時にとてもうれしいみたいです。,特に、野球とサッカーを見る時にとてもうれしいみたいです。
でも、母は父がテレビを見るのが嫌いです。,でも、母は父がテレビを見るのが嫌いです。
母は料理するのが好きで、とても上手だと思います。,母は料理するのが好きで、とても上手だと思います。
母は韓国のドキュメンタリーを見るのが好きです。,母は韓国のドキュメンタリーを見るのが好きです。
母はとても元気で、すごく面白い人だと思います。,母はとても元気で、すごく面白い人だと思います。
兄は２５歳です。,兄は２５歳です。
兄はビデオゲームをしたり、アニメを見たりするのが好きです。,兄はビデオゲームをしたり、アニメを見たりするのが好きです。
驚くべきことに、最近、兄はまた‘遊戯王’  というトランプゲームを始まりました。,驚くべきことに、最近、兄はまた‘遊戯王’  というトランプゲームを始めました。
兄も大学生の時に、日本語を勉強しましたけど、もうしません。,兄も大学生の時に、日本語を勉強しましたけど、もうしていません。
