私はよく勉強しますから、とても忙しいです。,私はたくさん勉強しますから、とても忙しいです。
でも、忙しくないのときは、アニメを見て、ビデオゲイムをします。,でも、忙しくないのときは、アニメを見て、ビデオゲイムをします。
アニメとゲイムはとても楽しいと面白い。,アニメとゲームはとても楽しくて面白い。
一生のときは、五百時間ぐらい見て、三百時間ぐらいしました。,一生のときは、五百時間ぐらい見て、三百時間ぐらいしました。
私の友だちは、私あまりにも多くアニメを見ると思います。,私の友だちは、私がアニメを見すぎると思っています。
私は、私の友だちは、正しいと思います。,私は、私の友だちが、正しいと思います。
今年は、あまりアニメを見て、ゲイムをしません。,今年は、あまりアニメを見たり、ゲイムをしたりしていせん。
私はよく生化学を勉強して、アルバイトをしますから。,私はよく生化学を勉強して、アルバイトをしますから。
私は、アニメは日本語の練習に役立つと思います。,私は、アニメは日本語の練習に役立つと思います。
アニメは、ギンタマと四畳半神話大系が好きです。,アニメは、ギンタマと四畳半神話大系が好きです。
ゲイムは、ホライゾンゼロダーンとウィートチャが好きです。,ゲイムは、ホライゾンゼロダーンとウィートチャが好きです。
ゲイムはたのしいから、ゲイムをするのが好きです。,ゲイムはたのしいから、ゲイムをするのが好きです。
私の家族は四人家族です。,私の家族は四人家族です。
父と母とあねがいます。,父と母とあねがいます。
私の母は日本人で、父はメキシコ人です。,私の母は日本人で、父はメキシコ人です。
父と母は大学のときに出会いました。,父と母は大学のときに出会いました。
母はしずかですが、おもしろいです。,母はしずかですが、おもしろいです。
今、母は会社に勤めています。,今、母は会社に勤めています。
でも私が小さかったころ、母は主婦でした。,でも私が小さかったころ、母は主婦でした。
私の父はとても元気で、あたまがいい人です。,私の父はとても元気で、あたまがいい人です。
私は生まれたときから今までBPの会社につとめています。,私は生まれたときから今までBPの会社につとめています。
あねはMITの四年生の学生です。,あねはMITの四年生の学生です。
せんこうは生物学です。,せんこうは生物学です。
来年あねはシカゴの大学の大学院生になります。,来年あねはシカゴ大学の大学院生になります。
私は今あねとマコーミックのりょうに住んでいます。,私は今あねとマコーミックのりょうに住んでいます。
時々けんかをしますが、あねと住むのは楽しいしべんりです。,時々けんかをしますが、あねと住むのは楽しいしべんりです。
私の家族はよくりょこうします。,私の家族はよくりょこうします。
子どもの時は何度か日本とメキシコに行きました。,子どもの時は何度か日本とメキシコに行きました。
家族でよくハイキングとさんぽをします。,家族でよくハイキングとさんぽをします。
さいごに私の家族の一番大切なメンバーはうちの犬の花子です。,さいごに私の家族の一番大切なメンバーはうちの犬の花子です。
しば犬ですがとてもかわいくておもしろいです。,しば犬ですがとてもかわいくておもしろいです。
へんなことをしていないとき、花子はよく寝ています。,何もしていないとき、花子はよく寝ています。
私の家族 は 四人 です。,私の家族 は 四人 です。
私の父 は メキシコ人 で エンジニア です。,私の父 は メキシコ人 で エンジニア です。
父 は あたまがいい です。,父 は あたまがいい です。
私の母 は アメリカ人 で がっこの先生 です。,私の母 は アメリカ人 で がっこうの先生 です。
母 は しんせつな人 です。,母 は しんせつな人 です。
私の双子のあね は 大学生 です。,私の双子のあね は 大学生 です。
タフツ大学 で べんきょします。,タフツ大学 で べんきょうしています。
私のあねのせんこお は いきものがく です。,私のあねのせんこうは 生物学です。
私のあね は 二十一歳 です。,私のあね は 二十一歳 です。
ペット が います。,ペット が います。
家族のペット は やさしくて大きいな いぬ です。,家族のペット は やさしくて大きいな いぬ です。
いぬ の なまえ は ハーシー です。,いぬ の なまえ は ハーシー です。
ハーシー は ラブラドール の いぬ です。,ハーシー は ラブラドール 犬です。
私の家族が三人いて、あねが一人います。,私の家族は三人いて、あねが一人います。
母と父はニューヨークのソマーズにすんでいます。,母と父はニューヨークのソマーズにすんでいます。
母の仕事はアーティストで、父の仕事は映画監督です。,母の仕事はアーティストで、父の仕事は映画監督です。
母はりょうりするのがじょうずです。,母はりょうりするのがじょうずです。
母と父はあたまがよくて、しんせつで、せがひくいです。,母と父はあたまがよくて、しんせつで、せがひくいです。
あねは二十三さいです。,あねは二十三さいです。
あねは大学院二年生で、バークレー にすんでいます。,あねは大学院二年生で、バークレー にすんでいます。
あねはカリフォルニアにすんでいるのがすきだと言っていて、天気はいいですから。,あねはカリフォルニアは天気がいいから、カリフォルニアに住むのがすきだと言っています。
大学生の時、あねのせんこうは化学工学でした。,大学生の時、あねのせんこうは化学工学でした。
ねこがいって、なまえはモチです。,ねこがいて、なまえはモチです。
せんしゅう、私の家族はいぬをアダプトして、なまえはパピです。,せんしゅう、私の家族はいぬをアダプトして、なまえはパピです。
クリスマスの時、祖母はこの写真をとりました。,クリスマスの時、祖母はこの写真をとりました。
写真に七人の家族がいます。,写真に七人の家族がうつっています。
僕は兄弟が三人います。,僕は兄弟が三人います。
写真の左上に妹マギがいます。,写真の左上に妹のマギがいます。
専攻は機械工学です。,専攻は機械工学です。
写真の下右に弟が二人います。,写真の右下に弟が二人います。
ナタヌ君は医学生で、ジャイ君は文学生です。,ナタヌ君は医学生で、ジャイ君は文学の学生です。
いとこマニスも文学生です。,いとこのマニスも文学の学生です。
ペットが一匹います。,ペットが一匹います。
カルシウムと言っています。,カルシウムと言います。
可愛くて、忠実な犬です。,可愛くて、忠実な犬です。
写真の左に親が二人います。,写真の左に両親がいます。
母はピアノを引いて、父は会計士です。,母はピアノをひいて、父は会計士です。
凄い家族ですが、フランスに住んでいます。,凄い家族ですが、フランスに住んでいます。
私は、家族が三人います。,私は、家族が三人います。
家族はとても優しくて元気です。,家族のみんなはとても優しくて元気です。
父はレストランに勤めています。,父はレストランに勤めています。
寿司のシェフです。,寿司のシェフです。
美味しい寿司を作るのが上手です。,美味しい寿司を作るのが上手です。
母の料理も美味しいです。,母の料理も美味しいです。
アメリカに来た時、料理をするのが知っていませんでしたが母は自分で習いました。,アメリカに来た時、料理をするのを知りませんでしたが、母は自分で習いました。
しかし、私は料理するのが下手です。,しかし、私は料理するのが下手です。
兄は大学院生です。,兄は大学院生です。
兄の専攻は経営学です。,兄の専攻は経営学です。
兄は忙しです。,兄は忙しいです。
たくさんプロジェケトがありますから。,たくさんプロジェケトがありますから。
時々、一緒にコンピューターのゲムをします。,時々、一緒にコンピューターのゲームをします。
私の家族が大好きです。,私の家族が大好きです。
私の趣味はたくさんあります。,私は趣味がたくさんあります。
忙しいですが、満足です。,忙しいですが、満足しています。
言語を勉強するのが好きですから、よく新しい文化について学びます。,言語を勉強するのが好きですから、よく新しい文化について学びます。
今中国語、スペイン語、日本語、韓国語を勉強しています。,今中国語、スペイン語、日本語、韓国語を勉強しています。
とても便利なスキルです。,とても便利なスキルです。
例えば、病院にたくさん中国人患者がいます。,例えば、病院にたくさん中国人の患者がいます。
私は彼らが医者の言葉を分かるのを手伝います。,私は彼らが医者の言葉が分かるようになるのを手伝います。
それからダンス、歌、フィギュアスケート、演技が大好きです。,それからダンス、歌、フィギュアスケート、演技が大好きです。
ピアノ、バイオリン、クラリネット、ギターも楽しんでいます。,ピアノ、バイオリン、クラリネット、ギターも楽しんでいます。
この世界は大きくて、綺麗です。,この世界は大きくて、綺麗です。
その時、踊りを振り付けて、歌を書きます。,その時、踊りを振り付けて、歌を書きます。
自分の気持ちを音楽にして、素晴らしい気持ちですよ。,自分の気持ちを音楽にするのは、素晴らしい気持ちになりますよ。
MITは中学生と高校生の為に作ったプログラムがたくさんあります。,MITは中学生と高校生の為に作ったプログラムがたくさんあります。
あの生徒たちの学校はあまりお金がたくさんありませんから、先生たちは忙しくて、疲れています。,あの学校の生徒たちはあまりお金がたくさんありませんから、先生たちは忙しくて、疲れています。
全ての学生を手伝う時間がありませんが、MITはリソースがあります。,全ての学生を手伝う時間がありませんが、MITはリソースがあります。
生徒たちと楽しい実験をして、面白い先生と話して、ラブツアーに行きます。,生徒たちと楽しい実験をして、面白い先生と話して、ラブツアーに行きます。
生徒たちは新しいことを学んで、たくさん質問をします。,生徒たちは新しいことを学んで、たくさん質問をします。
それは私を幸せにします。,それは私を幸せにします。
たくさん趣味がありますが、それらは全て私に特別な物です。,たくさん趣味がありますが、それらは全て私に特別なことです。
今、たくさん趣味が有りません、MITの学生ですから。,今、MITの学生ですから、あまり趣味が有りません。
よく宿題と勉強がありますから、趣味をするの時間が有りません。,よく宿題と勉強がありますから、趣味をする時間が有りません。
週末、よく友達とヴィデオゲームをして、たいてい休みます。,週末、よく友達とビデオゲームをして、たいてい休みます。
それから、cryptocurrencyを売り込んでいますから、よく価格を見ます。,それから、cryptocurrencyを売り込んでいますから、よく価格を見ます。
今、市場は悪いです、だからお金をちょっと失った。,今、市場は悪いですから、ちょっと損した。
高校の時、私は楽団員で、バリトンを演奏して、マーチングバンドをしました。,高校の時、私は楽団員で、バリトンを演奏して、マーチングバンドをしました。
子供の時、フルトとテナー・サクソフォンも演奏しました。,子供の時、フルートとテナー・サクソフォンも演奏しました。
マーチングバンドはとても難しくて、楽しいと思いました。,マーチングバンドはとても難しくて、楽しいと思いました。
毎晩運動しました。,毎晩運動しました。
よく高校と家の間の公園に走りました。,よく高校と家の間の公園で走りました。
私の家族は二人います。,私の家族は二人います。
兄弟がいません。,兄弟がいません。
両親は中国の杭州に住んでいますけど、私はアメリカのボストンに住んでいます。,両親は中国の杭州に住んでいますけど、私はアメリカのボストンに住んでいます。
父は中国の会社に勤めていて、頭がよくて、忙しい人です。,父は中国の会社に勤めていて、頭がよくて、忙しい人です。
毎日はやく会社に行って、遅く帰って、よく週末休みません。,毎日はやく会社に行って、遅く帰って、あまり週末休みません。
会社員の仕事はとても大変だと思います。,会社員の仕事はとても大変だと思います。
母は綺麗で、親切です。,母は綺麗で、親切です。
病院に勤めています。,病院に勤めています。
それから料理するのがすごく上手です。,それから料理するのがすごく上手です。
だから私がいつも元気で、あまり病院に行きませんよ。,だから私がいつも元気で、あまり病院に行きませんよ。
私は二十一歳で、三年生で、MITに言語学とコンピュータを専攻しに来ています。,私は二十一歳で、三年生で、MITで言語学とコンピュータを専攻しています。
大学の時、母が日本語を勉強しました。,大学の時、母が日本語を勉強しました。
そして私も日本語を勉強するのが大好きで、毎日話しています。,そして私も日本語を勉強するのが大好きで、毎日話しています。
私は暇でわありませんが、毎週家に電話をかけています。,私は暇はありませんが、毎週家に電話をかけています。
私の家族を思っていますから。,私の家族を思っていますから。
今日は、私のちゅうごく人の友だちをしょうかいします。,今日は、私のちゅうごく人の友だちをしょうかいします。
友だちの名前は、リンさんです。,友だちの名前は、リンさんです。
リンさんは、MITのよんねんせいで、せんこうはコンピューターです。,リンさんは、MITのよねんせいで、せんこうはコンピューターです。
子どもの時、リンさんはちゅうごくのふくしゅうしにすんでいました。,子どもの時、リンさんは中国の福州市にすんでいました。
十一さいの時、ニューヨークに行っていました。,十一さいの時、ニューヨークに行きました。
今ケンブリッジにすんでいます。,今ケンブリッジにすんでいます。
リンさんは、とてもあたまがよくて、おもしろいです。,リンさんは、とてもあたまがよくて、おもしろいです。
きょねんのなつ、リンさんはアマゾンにつとめていました。,きょねんのなつ、リンさんはアマゾンにつとめていました。
仕事はむずかしくなかったと言っていました。,仕事はむずかしくなかったと言っていました。
リンさんは、うたをうたうのがすきですから、よくカラオケに行きます。,リンさんは、うたをうたうのがすきですから、よくカラオケに行きます。
たくさんちゅうごくのうたがじょうずで、日本のうたも知っています。,とてもちゅうごくのうたがじょうずで、日本のうたも知っています。
それから、リンさんは、こわいえいががだいすきです。,それから、リンさんは、こわいえいががだいすきです。
日本のこわいえいがはいいと言っていました。,日本のこわいえいがはいいと言っていました。
私の家族は六人です、あねが三人います。,私の家族は六人で、あねが三人います。
母と父はマイアミにすんでいますが、きょうだいはマイアミにすんでいません。,母と父はマイアミにすんでいますが、きょうだいはマイアミにすんでいません。
あねのなまえはジャキとクリステイナとエリカです。,あねのなまえはジャキとクリステイナとエリカです。
ジャキさんはテクサスにすんでいて、ウエークフォレスト大学いんで、 癌生物学をべんきょうしています。,ジャキさんはテクサスにすんでいて、ウエークフォレスト大学院で、 癌生物学をべんきょうしています。
クリステイーナさんはメアリーランドにすんで、いしゃにつとめています。,クリステイーナさんはメアリーランドにすんで、医者としてつとめています。
エリカさんはフロリダ大学で機械工学をべんきょうしています。,エリカさんはフロリダ大学で機械工学をべんきょうしています。
家族はとてもおもしろいです。,家族はとてもおもしろいです。
母と父は学校に行きませんでしたが、きょうだいはみんな大学か大学いんでべんじょうしています。,母と父は学校に行きませんでしたが、きょうだいはみんな大学か大学院でべんじょうしています。
とてもあたまがいいぎいです。,とてもあたまがいいです。
あねみんなべんきょうするのがすきです。,姉達は、みんなべんきょうするのがすきです。
私はべんきょうするのがすきじゃないです。,私はべんきょうするのがすきじゃないです。
私の家族は三人です。,私の家族は三人です。
私は一人っ子ですが、子供の時全然寂しくなかったです。,私は一人っ子ですが、子供の時全然寂しくなかったです。
父は大学の先生で、とても親切で面白い人です。,父は大学の先生で、とても親切で面白い人です。
彼は若時から合気道を連取していて、私に子供の時から教えています。,彼は若い時から合気道を練習していて、私に子供の時から教えています。
母も大学に勤めていて、頭がいい人です。,母も大学に勤めていて、頭がいい人です。
母は時々料理しますが、父は料理するのが好きでとても上手ですから、彼がたいてい晩ご飯を作ります。,母は時々料理しますが、父は料理するのが好きでとても上手ですから、彼がたいてい晩ご飯を作ります。
家族はフロリダに住んでいます。,家族はフロリダに住んでいます。
私は出身にいる時はよく祖父と祖母に会いに行きます。,私は田舎にいる時はよく祖父と祖母に会いに行きます。
祖父と祖母は私の家の近くに住んでいますから、とても便利です。,祖父と祖母は私の家の近くに住んでいますから、とても便利です。
祖母はとてもやさしくて、元気な人です。,祖母はとてもやさしくて、元気な人です。
祖母と一緒に料理するのが大好きです。,祖母と一緒に料理するのが大好きです。
祖父は面白い人です。,祖父は面白い人です。
祖父と祖母はアラビア語だけを話して、私はアラビア語を話すのがまだまだですから、時々会話するのがちょっと難しいです。,祖父と祖母はアラビア語だけを話して、私はアラビア語を話すのがまだまだですから、時々会話するのがちょっと難しいです。
でも、父は私のアラビア語の勉強を手伝いて、私はすぐに祖父と祖母とアラビア語を上手に話すと言っています。,でも、父は私のアラビア語の勉強を手伝ってくれていて、私はすぐに祖父と祖母とアラビア語で上手に話せるようになると言っています。
私のかぞくは五人います。,私のかぞくは五人います。
父と母はメキシコ人です。,父と母はメキシコ人です。
父の食べものはときどきおいしいで、母の食べものはいつもとてもおいしいいです。,父の食べものはときどきおいしいけど、母の食べものはいつもとてもおいしいいです。
父のなまえはアルノルドです。,父の名前はアルノルドです。
母のなまえはマリアです。,母の名前はマリアです。
私のあねのなまえはラウラとベアテイリズです。,私の姉の名前はラウラとベアテイリズです。
ラウラさんは二十九さいで、そして高校の先生です。,ラウラさんは二十九さいで、高校の先生です。
ラウラさんは2人のこどもとけっこんしています。,ラウラさんは結婚していて、二人の子供がいます。
ラウラさんはときどき仕事はむずかしいと言っていました、けど私はあねの仕事はやさしいと思います。,ラウラさんはときどき仕事はむずかしいと言っていましたけど、私はあねの仕事はやさしいと思います。
ベアテイリズさんは大学にすうがくをべんきょうしに行きました。,ベアテイリズさんは大学に数学を勉強しに行きました。
ベアテイリズさんはちょっ食べますから、やせています。,ベアテイリズさんはちょっとしか食べませんから、やせています。
ベアテイリズさんは本を読むのがすきです。,ベアテイリズさんは本を読むのがすきです。
私とラウラさんとベアテイリズさんはコンサートにうたを聞きに行きました。,私とラウラさんとベアテイリズさんはコンサートにうたを聞きに行きました。
たのしいですよ。,たのしいですよ。
今年八月私はうちで帰ります。,今年八月私はうちに帰ります。
私とかぞは話します、そして母の食べもの食べます。,私は家族のみんなと話したり、て母の食べもの食べたりします。
この九月私のともだちは私に囲碁についておしえました。,この九月私のともだちは私に囲碁について教えてくれました。
なつの時、アーロンさんはアニメを見ました、それからうちはじめました。,なつの時、アーロンさんはアニメを見てからうちはじめました。
アーロンさのうつのが上手で、私のうつのが下手ですけど、よく一緒に囲碁をうちます。,アーロンさんは、囲碁をうつのが上手で、私は、うつのが下手ですけど、よく一緒に囲碁をうちます。
囲碁はアメリカであまりゆうめいじゃないですが、ボストンでたくさん囲碁がおもしろいと思う人がいます。,囲碁はアメリカであまり有名じゃないですが、ボストンにたくさん囲碁がおもしろいと思う人がいます。
囲碁のサークルのメンバーは、みんなしんせつで、私たちをてつだっています。,囲碁のサークルのメンバーは、みんなしんせつで、私たちをてつだってくれます。
ケンブリッジとしょかんでうつ一人は私たちの先生です。,ケンブリッジ図書館でうつ一人は私たちの先生です。
なまえはチョーさんです。,名前はチョーさんです。
かん国人で、七十七さいです。,韓国人で、七十七さいです。
ときどきチョー先生のうちにも囲碁を勉強しに行きます。,ときどきチョー先生の家にも囲碁を勉強しに行きます。
たくさんうつ時、私はどこでも囲碁を見はじめます、ねる時も囲碁について思います。,たくさんうった時、私はいつも囲碁のことを考えるし、ねる時も囲碁について色々考えます。
